C3: Hôtels proposed for Emedisys 2007
A5: Hôtel | B5: Adresse | C5: Tél-1 | D5: Tél-2 | E5: Fax : | F5: S PD | G5: S PD 1/2P | H5: D PD | I5: D PD 1/2P | J5: Email : | K5: Web
A7: Menzeh Zalagh **** | B7: Lot Oued Fes Route De Meknes Fès | C7: 35642407 | E7: +212 35651995 | F7: 538 | G7: 638 | H7: 776 | I7: 976
A8: Splendid *** | B8: 9, Rue Abdelkrim El Khattabi Fes | C8: (212) 35 62 21 48 | D8: (212) 65 02 83 | E8: +212 35 65 48 92 | F8: 316 | G8: 428 | H8: 412 | I8: 636 | J8: splendid@menara.ma | K8: www.splendidf.ma
A9: Wassim *** | B9: Bd. Hassan 11, Rue Du Liban Fez 3000 | C9: 35654939 | E9: +212 35930220
A10: Batha *** | B10: Place Batha Istiqlal BP 505 Fez
A11: Ibis Moussafir *** | B11: Av Des Almohades Place De La Gare 30000 Fez | C11: +212 651902 | E11: +212 651902
A12: Tghat ***/**** | B12: 28 29 AVENUE DES FAR | F12: =415+60 -> 475 | G12: =F12+80 -> 555 | H12: =502+120 -> 622 | I12: =H12+160 -> 782
A13: Perla *** | B13: 15, rue de la jourdanie, quartier de la gare VN Fès | C13: (212) 35 94 36 42 | D13: (212) 35 94 36 42 | E13: +212 35 94 36 44 | F13: 289 | G13: 389 | H13: =189*2 -> 378 | I13: =289*2 -> 578 | J13: hotelperlamaroc@menara.ma | K13: www.hotelperlamaroc.com
A14: Sofia **** | B14: 3, RUE DE L ARABIE SAUDITE BP 2098 | C14: +212 35624665 | D14: +212 35624265 | E14: =+212 35626478
A15: Mounia *** | B15: 61 Boulevard Zerktouny 30000 Fez | C15: +212 35624838 | D15: +212 35650771 | E15: +212 35650773 | F15: 373 | G15: =F15+150 -> 523 | H15: 486 | I15: =H15+300 -> 786 | J15: hotel.mounia.fes@menara.ma
A16: Volubilis *** | C16: +212 35624484 | D16: +212 35943774
A17: Royal Mirage *** | B17: Avenue Des Far Bp 2489 Fes | C17: 035930909 | E17: +212 35620486
A19: Prices in Dirhams
A20: 1 Euro = ~ 11 DH
A22: Special Prices for Emedisys/Mekouar 40/50%
A23: S PD | B23: Single with breakfast
A24: S PD 1/2 P | B24: Single with breakfast and half-board
A25: D PD | B25: Double with breakfast
A26: D PD 1/2 P | B26: Double with breakfast and half-board
A28: We recommend in particular Menzeh Zalagh **** et Splendid ***